[
  {
    "listingId": "river-ward-farm-durban-poison",
    "licenseNumber": "OCM-CAURD-24-000104",
    "capturedAt": "2026-09-04T16:00:00Z",
    "strainNameRaw": "Durban Poison",
    "strainNameCanonical": "durban poison",
    "brand": "River Ward Farm",
    "lineage": "SATIVA",
    "thcPercent": 18.6,
    "cbdPercent": 0.14,
    "totalCannabinoidsPercent": null,
    "terpenes": {
      "source": "LAB_COA",
      "profile": [
        {
          "name": "TERPINOLENE",
          "rawName": null,
          "percent": 1.15
        },
        {
          "name": "OCIMENE",
          "rawName": null,
          "percent": 0.43
        },
        {
          "name": "MYRCENE",
          "rawName": null,
          "percent": 0.26
        }
      ],
      "totalPercent": 1.84,
      "labName": "Empire Labs NY",
      "testedOn": "2026-07-11",
      "coaUrl": "https://example-lab.test/coa/durban-poison-river-ward-farm",
      "referenceStrain": null
    },
    "harvestedOn": null,
    "packagedOn": "2026-05-09",
    "inStock": true,
    "availableSizesGrams": [
      3.5
    ],
    "productUrl": null,
    "sources": [
      {
        "url": "https://www.kingshouseoffire.com",
        "label": "Illustrative sample menu",
        "type": "MENU_PLATFORM",
        "retrievedAt": "2026-09-04T16:00:00Z"
      }
    ],
    "warnings": []
  },
  {
    "listingId": "river-ward-farm-gmo-cookies",
    "licenseNumber": "OCM-CAURD-24-000104",
    "capturedAt": "2026-09-04T16:00:00Z",
    "strainNameRaw": "GMO Cookies",
    "strainNameCanonical": "gmo cookies",
    "brand": "River Ward Farm",
    "lineage": "INDICA_DOMINANT",
    "thcPercent": 19.9,
    "cbdPercent": 0.05,
    "totalCannabinoidsPercent": null,
    "terpenes": {
      "source": "STRAIN_REFERENCE",
      "profile": [
        {
          "name": "CARYOPHYLLENE",
          "rawName": null,
          "percent": 0.83
        },
        {
          "name": "LIMONENE",
          "rawName": null,
          "percent": 0.44
        },
        {
          "name": "MYRCENE",
          "rawName": null,
          "percent": 0.28
        }
      ],
      "totalPercent": 1.55,
      "labName": null,
      "testedOn": null,
      "coaUrl": null,
      "referenceStrain": "GMO Cookies"
    },
    "harvestedOn": null,
    "packagedOn": "2026-06-05",
    "inStock": true,
    "availableSizesGrams": [
      1,
      3.5
    ],
    "productUrl": null,
    "sources": [
      {
        "url": "https://www.kingshouseoffire.com",
        "label": "Illustrative sample menu",
        "type": "MENU_PLATFORM",
        "retrievedAt": "2026-09-04T16:00:00Z"
      }
    ],
    "warnings": []
  },
  {
    "listingId": "fallow-field-gardens-gelato-33",
    "licenseNumber": "OCM-CAURD-24-000104",
    "capturedAt": "2026-09-04T16:00:00Z",
    "strainNameRaw": "Gelato #33",
    "strainNameCanonical": "gelato 33",
    "brand": "Fallow Field Gardens",
    "lineage": "HYBRID",
    "thcPercent": 29.2,
    "cbdPercent": 0.27,
    "totalCannabinoidsPercent": null,
    "terpenes": {
      "source": "LAB_COA",
      "profile": [
        {
          "name": "CARYOPHYLLENE",
          "rawName": null,
          "percent": 0.61
        },
        {
          "name": "LIMONENE",
          "rawName": null,
          "percent": 0.5
        },
        {
          "name": "LINALOOL",
          "rawName": null,
          "percent": 0.16
        }
      ],
      "totalPercent": 1.27,
      "labName": "Empire Labs NY",
      "testedOn": "2026-07-21",
      "coaUrl": "https://example-lab.test/coa/gelato-33-fallow-field-gardens",
      "referenceStrain": null
    },
    "harvestedOn": null,
    "packagedOn": "2026-07-20",
    "inStock": true,
    "availableSizesGrams": [
      3.5,
      14,
      28
    ],
    "productUrl": null,
    "sources": [
      {
        "url": "https://www.kingshouseoffire.com",
        "label": "Illustrative sample menu",
        "type": "MENU_PLATFORM",
        "retrievedAt": "2026-09-04T16:00:00Z"
      }
    ],
    "warnings": []
  },
  {
    "listingId": "eastbound-cannabis-co-granddaddy-purple",
    "licenseNumber": "OCM-CAURD-24-000104",
    "capturedAt": "2026-09-04T16:00:00Z",
    "strainNameRaw": "Granddaddy Purple",
    "strainNameCanonical": "granddaddy purple",
    "brand": "Eastbound Cannabis Co.",
    "lineage": "INDICA",
    "thcPercent": 23.0,
    "cbdPercent": 0.21,
    "totalCannabinoidsPercent": null,
    "terpenes": {
      "source": "LAB_COA",
      "profile": [
        {
          "name": "MYRCENE",
          "rawName": null,
          "percent": 0.89
        },
        {
          "name": "CARYOPHYLLENE",
          "rawName": null,
          "percent": 0.35
        },
        {
          "name": "PINENE_ALPHA",
          "rawName": null,
          "percent": 0.18
        }
      ],
      "totalPercent": 1.42,
      "labName": "Keystone State Testing",
      "testedOn": "2026-07-07",
      "coaUrl": "https://example-lab.test/coa/granddaddy-purple-eastbound-cannabis-co",
      "referenceStrain": null
    },
    "harvestedOn": null,
    "packagedOn": "2026-05-04",
    "inStock": true,
    "availableSizesGrams": [
      3.5,
      7,
      14,
      28
    ],
    "productUrl": null,
    "sources": [
      {
        "url": "https://www.kingshouseoffire.com",
        "label": "Illustrative sample menu",
        "type": "MENU_PLATFORM",
        "retrievedAt": "2026-09-04T16:00:00Z"
      }
    ],
    "warnings": []
  },
  {
    "listingId": "northline-cultivation-jack-herer",
    "licenseNumber": "OCM-CAURD-24-000104",
    "capturedAt": "2026-09-04T16:00:00Z",
    "strainNameRaw": "Jack Herer",
    "strainNameCanonical": "jack herer",
    "brand": "Northline Cultivation",
    "lineage": "SATIVA",
    "thcPercent": 26.3,
    "cbdPercent": 0.05,
    "totalCannabinoidsPercent": null,
    "terpenes": {
      "source": "LAB_COA",
      "profile": [
        {
          "name": "TERPINOLENE",
          "rawName": null,
          "percent": 0.77
        },
        {
          "name": "CARYOPHYLLENE",
          "rawName": null,
          "percent": 0.33
        },
        {
          "name": "PINENE_BETA",
          "rawName": null,
          "percent": 0.19
        }
      ],
      "totalPercent": 1.29,
      "labName": "Hudson Analytical",
      "testedOn": "2026-07-08",
      "coaUrl": "https://example-lab.test/coa/jack-herer-northline-cultivation",
      "referenceStrain": null
    },
    "harvestedOn": null,
    "packagedOn": "2026-05-28",
    "inStock": true,
    "availableSizesGrams": [
      1,
      3.5
    ],
    "productUrl": null,
    "sources": [
      {
        "url": "https://www.kingshouseoffire.com",
        "label": "Illustrative sample menu",
        "type": "MENU_PLATFORM",
        "retrievedAt": "2026-09-04T16:00:00Z"
      }
    ],
    "warnings": []
  },
  {
    "listingId": "fallow-field-gardens-lemon-cherry-gelato",
    "licenseNumber": "OCM-CAURD-24-000104",
    "capturedAt": "2026-09-04T16:00:00Z",
    "strainNameRaw": "Lemon Cherry Gelato",
    "strainNameCanonical": "lemon cherry gelato",
    "brand": "Fallow Field Gardens",
    "lineage": "HYBRID",
    "thcPercent": 29.0,
    "cbdPercent": 0.18,
    "totalCannabinoidsPercent": null,
    "terpenes": {
      "source": "LAB_COA",
      "profile": [
        {
          "name": "LIMONENE",
          "rawName": null,
          "percent": 0.74
        },
        {
          "name": "CARYOPHYLLENE",
          "rawName": null,
          "percent": 0.5
        },
        {
          "name": "LINALOOL",
          "rawName": null,
          "percent": 0.12
        }
      ],
      "totalPercent": 1.36,
      "labName": "Hudson Analytical",
      "testedOn": "2026-07-18",
      "coaUrl": "https://example-lab.test/coa/lemon-cherry-gelato-fallow-field-gardens",
      "referenceStrain": null
    },
    "harvestedOn": null,
    "packagedOn": "2026-08-03",
    "inStock": true,
    "availableSizesGrams": [
      3.5,
      7
    ],
    "productUrl": null,
    "sources": [
      {
        "url": "https://www.kingshouseoffire.com",
        "label": "Illustrative sample menu",
        "type": "MENU_PLATFORM",
        "retrievedAt": "2026-09-04T16:00:00Z"
      }
    ],
    "warnings": []
  },
  {
    "listingId": "fallow-field-gardens-mac-1",
    "licenseNumber": "OCM-CAURD-24-000104",
    "capturedAt": "2026-09-04T16:00:00Z",
    "strainNameRaw": "MAC 1",
    "strainNameCanonical": "mac 1",
    "brand": "Fallow Field Gardens",
    "lineage": "HYBRID",
    "thcPercent": 30.8,
    "cbdPercent": 0.24,
    "totalCannabinoidsPercent": null,
    "terpenes": {
      "source": "MENU_LISTING",
      "profile": [
        {
          "name": "LIMONENE",
          "rawName": null,
          "percent": null
        },
        {
          "name": "CARYOPHYLLENE",
          "rawName": null,
          "percent": null
        }
      ],
      "totalPercent": null,
      "labName": null,
      "testedOn": null,
      "coaUrl": null,
      "referenceStrain": null
    },
    "harvestedOn": null,
    "packagedOn": "2026-08-09",
    "inStock": true,
    "availableSizesGrams": [
      7,
      28
    ],
    "productUrl": null,
    "sources": [
      {
        "url": "https://www.kingshouseoffire.com",
        "label": "Illustrative sample menu",
        "type": "MENU_PLATFORM",
        "retrievedAt": "2026-09-04T16:00:00Z"
      }
    ],
    "warnings": []
  },
  {
    "listingId": "ninth-ward-farm-purple-punch",
    "licenseNumber": "OCM-CAURD-24-000104",
    "capturedAt": "2026-09-04T16:00:00Z",
    "strainNameRaw": "Purple Punch",
    "strainNameCanonical": "purple punch",
    "brand": "Ninth Ward Farm",
    "lineage": "INDICA",
    "thcPercent": 24.9,
    "cbdPercent": 0.06,
    "totalCannabinoidsPercent": null,
    "terpenes": {
      "source": "LAB_COA",
      "profile": [
        {
          "name": "MYRCENE",
          "rawName": null,
          "percent": 0.71
        },
        {
          "name": "CARYOPHYLLENE",
          "rawName": null,